0.999713	994/1000	1	0	/home/jjjjia/project/shared/MAGAssessment/fastas/chromosome/NZ_CP015866.fasta	NZ_CP015866.1 Streptomyces parvulus strain 2297 chromosome, complete genome
0.743837	2/1000	1	1.42958e-06	/home/jjjjia/project/shared/MAGAssessment/fastas/chromosome/NZ_LT635457.fasta	NZ_LT635457.1 Actinomyces sp. Marseille-P2985 strain Marseille-P2985T genome assembly, chromosome: contig00001
0.743837	2/1000	1	1.42958e-06	/home/jjjjia/project/shared/MAGAssessment/fastas/chromosome/NC_009338.fasta	NC_009338.1 Mycobacterium gilvum PYR-GCK, complete genome
0.719686	1/1000	1	0.00169127	/home/jjjjia/project/shared/MAGAssessment/fastas/chromosome/NZ_CP016483.fasta	NZ_CP016483.1 Synechococcus sp. PCC 8807 chromosome, complete genome
0.719686	1/1000	1	0.00169127	/home/jjjjia/project/shared/MAGAssessment/fastas/chromosome/NZ_CP015093.fasta	NZ_CP015093.1 Pelagibaca abyssi strain JLT2014 chromosome, complete genome
0.719686	1/1000	1	0.00169127	/home/jjjjia/project/shared/MAGAssessment/fastas/chromosome/NC_014100.fasta	NC_014100.1 Caulobacter segnis ATCC 21756, complete genome
0.719686	1/1000	1	0.00169127	/home/jjjjia/project/shared/MAGAssessment/fastas/chromosome/NC_011894.fasta	NC_011894.1 Methylobacterium nodulans ORS 2060, complete genome
0.719686	1/1000	1	0.00169127	/home/jjjjia/project/shared/MAGAssessment/fastas/chromosome/NC_010610.fasta	NC_010610.1 Lactobacillus fermentum IFO 3956 DNA, complete genome
0.719686	1/1000	1	0.00169127	/home/jjjjia/project/shared/MAGAssessment/fastas/chromosome/NC_010170.fasta	NC_010170.1 Bordetella petrii strain DSM 12804, complete genome
